<!ELEMENT resident (name, location, contact, socialmedia, medium, externalurl, artimage)>
<!ATTLIST resident type (artist|designer|collective) #REQUIRED>

<!ELEMENT name (#PCDATA)>
<!ATTLIST name (first_last|studio) "first_last">

<!ELEMENT location (#PCDATA)>
<!ATTLIST location type (building|suite) "suite">

<!ELEMENT contact (#PCDATA)>
<!ATTLIST contact type (email|phone) "email">

<!ELEMENT socialmedia (#PCDATA)>
<!ATTLIST socialmedia type (instagram|facebook|pinterest) "instagram">

<!ELEMENT medium (#PCDATA)>
<!ELEMENT externalurl (#PCDATA)>

<!--this has to become a jpg somehow-->
<!ELEMENT artimage (#PCDATA)>


<!--EVENTS ELEMENTS-->
<!ELEMENT events (eventstitle, type, Summary, Dates, Times, EventImage, Caption)>
<!ELEMENT eventstitle (#PCDATA)>
<!ELEMENT type (#PCDATA)>
<!ELEMENT Summary (#PCDATA)>
<!ELEMENT Dates (#PCDATA)>
<!ELEMENT Times (#PCDATA)>
<!ELEMENT EventImage (image?)>
<!ELEMENT Caption (#PCDATA)>

<!ELEMENT year (#PCDATA)>
