<?xml version="1.0" encoding="UTF-8"?>
<?xml-stylesheet type="text/css" href="styles.css"?>

<!DOCTYPE events SYSTEM "2010_DTD.dtd">

	<events>
		<eventtitle>Art a Whirl</eventtitle>
		<type>Event</type>
		<Summary>This is a big event! Stop by!</Summary>
			<Dates>October 12-14, 2019</Dates>
			<Times>11AM-9PM</Times>
			<EventImage>abc.jpg</EventImage>
			<Caption>Look at all the artists in the building.</Caption>


		<eventtitle>Art a Whirl
			<type>Event</type>
		<Summary>This is a big event! Stop by!</Summary>
			<Dates>October 12-14, 2019</Dates>
			<Times>11AM-9PM</Times>
			<EventImage>xyz.jpg</EventImage>
			<Caption>Look at all the artists in the building.</Caption>
		</eventtitle>

	</events>
